{
  "employeeName": "LAZIONE UNIVARSITA' 2017",
  "employerName": "DITTA DI PROVA",
  "codiceFiscale": "LZNNRS80A41D548V",
  "payPeriod": "GENNAIO 2017",
  "payLines": [
    {
      "voce": "0",
      "description": "Retribuzione ordinaria",
      "unitaDiMisura": "GIORNI",
      "quantita": 23.0,
      "base": 67.66808,
      "competenze": 1556.37
    },
    {
      "voce": "200",
      "description": "Ferie godute",
      "unitaDiMisura": "ORE",
      "quantita": 32.0
    },
    {
      "voce": "210",
      "description": "Permessi riduz. orario goduti",
      "unitaDiMisura": "ORE",
      "quantita": 4.0
    },
    {
      "voce": "221",
      "description": "Permessi ex-festivita' goduti",
      "unitaDiMisura": "ORE",
      "quantita": 4.0
    },
    {
      "voce": "230",
      "description": "Festivita'",
      "unitaDiMisura": "GIORNI",
      "quantita": 1.0,
      "base": 67.66808,
      "competenze": 67.67
    },
    {
      "voce": "232",
      "description": "Festivita' in domenica",
      "unitaDiMisura": "GIORNI",
      "quantita": 1.0,
      "base": 67.66808,
      "competenze": 67.67
    },
    {
      "voce": "400",
      "description": "Carenza malattia",
      "unitaDiMisura": "GIORNI",
      "quantita": 2.0,
      "base": 67.66808,
      "competenze": 135.34
    },
    {
      "voce": "978",
      "description": "Credito art. 1 DL 66/2014",
      "competenze": 80.0
    }
  ],
  "totaleCompetenze": 1907.05,
  "totaleTrattenute": 460.41,
  "nettoInBusta": 1447.0
}